{
 "metadata": {
  "artifact_type": "segment_proposals",
  "artifact_version": "1.0.0",
  "schema_version": "1.0.0",
  "batch_id": "glossary_batch_001_data_analyst_pilot",
  "run_id": "glossary_batch_001_data_analyst_pilot_08_c2",
  "prompt_version": "08_segment_detection@v1",
  "model": "claude-sonnet-5",
  "generated_at": "2026-10-02T00:00:00Z",
  "source_snapshot_id": "data_analytics.source_pack",
  "parent_artifact_hashes": {
   "video_candidates.json": "a9dd00375318a03dd502c9d981df36820d2e1bc6300e0fb93049ed206606252e",
   "coverage_briefs.json": "d0ef2fa55a4fc956f7aec86aa706596e791e638ea60e8c7c721fdb8273290611",
   "extracted_concepts.json": "8e3969d65e33ee46f6e3ca399cf9ada942a5b349eb85f07e6b5d60dfe6acdc8e"
  }
 },
 "batch_id": "glossary_batch_001_data_analyst_pilot",
 "proposals": [
  {
   "proposal_id": "prop_AsuPVZ_EjEw_sql_aggregate_functions",
   "concept_id": "sql.aggregate_functions",
   "path_id": "data_analyst",
   "video_id": "AsuPVZ_EjEw",
   "start_seconds": 0,
   "end_seconds": 289,
   "label": "Live SQL demo: COUNT, SUM, AVG, MAX, and MIN collapsing an orders table into single business numbers",
   "role": "worked_example",
   "covered_fact_ids": [
    "f1",
    "f2",
    "f3",
    "f4",
    "f5",
    "f6"
   ],
   "visual_mode": "screen_demo",
   "chapter_aligned": true,
   "transcript_evidence": "so if you apply the count function on this data isq going to go and start counting how many rows do we have so the total number is four",
   "issues": [
    "Catalogue's chapter titles for this video (e.g. 'Case Syntax' at 37s) do not match the actual content, which is entirely about aggregate functions (COUNT/SUM/AVG/MAX/MIN) from 0s onward -- an auto-generated-chapter mismatch, verified by reading the transcript rather than trusting the chapter list.",
    "End is placed right before the video pivots into GROUP BY ('don't forget about the aggregate functions if you combine it with a group by' at 289s), which is a blocked concept for this path/concept pairing."
   ]
  },
  {
   "proposal_id": "prop_Aw4ZHT3SYzc_spreadsheet_sorting",
   "concept_id": "spreadsheet.sorting",
   "path_id": "data_analyst",
   "video_id": "Aw4ZHT3SYzc",
   "start_seconds": 45,
   "end_seconds": 353,
   "label": "Sorting one column, then building a multi-level sort with a custom order in Excel's Sort dialog",
   "role": "tool_workflow",
   "covered_fact_ids": [
    "f1",
    "f3",
    "f4"
   ],
   "visual_mode": "annotated_ui",
   "chapter_aligned": true,
   "transcript_evidence": "here's our sample dataset we have information on division region apps and revenue",
   "issues": [
    "Doesn't cover f2 (sorting dates/times oldest-to-newest/newest-to-oldest) -- the dataset has no date column; only numeric and text sorting are demonstrated.",
    "The multi-level sort's first level reuses a custom list set up starting ~243s, inside the preceding 'Sorting by custom lists' chapter (218s); kept both in range so the multi-level demo's first-level setup isn't an unresolved reference."
   ]
  },
  {
   "proposal_id": "prop_BspcRHPiFk4_pandas_inspecting_dataframes",
   "concept_id": "pandas.inspecting_dataframes",
   "path_id": "data_analyst",
   "video_id": "BspcRHPiFk4",
   "start_seconds": 104,
   "end_seconds": 560,
   "label": "Four ways to get a first look at a DataFrame: head()/tail(), shape, dtypes, and info()",
   "role": "live_code_demo",
   "covered_fact_ids": [
    "f1",
    "f2",
    "f3",
    "f4"
   ],
   "visual_mode": "live_code",
   "chapter_aligned": true,
   "transcript_evidence": "once you load the data set you want to quickly explore it and get a sense of its content pandas has several method for this the first is the head and tail method",
   "issues": [
    "Range runs ~457s, over the live_code_demo band (2-6 min), because it covers four cumulative inspection methods (head/tail, shape, dtypes, info) on one running DataFrame; trimming further would cut into one of the four required facts.",
    "f5 (describe()) is not covered -- in this video describe() is taught only after the 'missing data' chapter (562s+), which covers the blocked concept pandas.missing_data_handling, so reaching describe() without passing through blocked content isn't possible in this video.",
    "End cut is placed right before the video's explicit pivot into missing-data handling ('real world data... contains lot of missing data') to keep that blocked concept out of the range."
   ]
  },
  {
   "proposal_id": "prop_BzwAZ1k3WEY_spreadsheet_aggregation_functions",
   "concept_id": "spreadsheet.aggregation_functions",
   "path_id": "data_analyst",
   "video_id": "BzwAZ1k3WEY",
   "start_seconds": 23,
   "end_seconds": 162,
   "label": "Live demo: SUM, AVERAGE, and COUNT on a column of numbers in Excel",
   "role": "tool_workflow",
   "covered_fact_ids": [
    "f1",
    "f2",
    "f3"
   ],
   "visual_mode": "screen_demo",
   "chapter_aligned": true,
   "transcript_evidence": "this sum aggregation is going to add all the numbers in a range of cells",
   "issues": [
    "f4 (COUNTA) is never demonstrated in this video -- it covers SUM, AVERAGE, and COUNT only, not COUNTA.",
    "AVERAGE's exact handling of text/logical/empty values per f2 isn't stated verbatim; the video only shows AVERAGE matching SUM/COUNT on an all-numeric range, not its behavior on mixed-content cells."
   ]
  },
  {
   "proposal_id": "prop_Ck0QgwiCEIs_pandas_dtype_conversion",
   "concept_id": "pandas.dtype_conversion",
   "path_id": "data_analyst",
   "video_id": "Ck0QgwiCEIs",
   "start_seconds": 384,
   "end_seconds": 449,
   "label": "Converting a column's values to bool with astype()",
   "role": "worked_example",
   "covered_fact_ids": [
    "f1"
   ],
   "visual_mode": "live_code",
   "chapter_aligned": true,
   "transcript_evidence": "And I'm just going to copy this because I'm lazy. We'll call the as type function and then pass in a new data type. For booleans, you type bool.",
   "issues": [
    "Only shows astype() converting one column to bool -- doesn't demonstrate converting multiple columns via a dict (f2), and doesn't show astype() raising an exception on an invalid conversion or explicitly state it returns a copy by default (other parts of f1); covered_fact_ids reflects the core conversion mechanic only.",
    "Range is short (~65s) because it's immediately bounded by the video's next chapter (removing duplicate rows), which covers the blocked concept pandas.drop_duplicates; extending forward would cross into that."
   ]
  },
  {
   "proposal_id": "prop_D5R9Iq3KaPI_python_sets",
   "concept_id": "python.sets",
   "path_id": "data_analyst",
   "video_id": "D5R9Iq3KaPI",
   "start_seconds": 526,
   "end_seconds": 695,
   "label": "Combining and comparing two sets with union (|) and intersection (&)",
   "role": "visual_mechanism",
   "covered_fact_ids": [
    "f5"
   ],
   "visual_mode": "live_code",
   "chapter_aligned": false,
   "transcript_evidence": "Okay. So now we come to the interesting part where we're going to talk about the mathematical operators in sets.",
   "issues": [
    "Only covers f5 (union/intersection) -- f1-f4 (unordered/no-duplicates definition, set() vs {} creation, set() from an iterable, the in membership operator) are taught earlier in this video (0-305s) in a separate, non-adjacent section; this proposal picks the math-operators section because it best matches this concept's stated need for a union/intersection visual (video_need), not because the rest of the video is unusable.",
    "Visual mode inferred as live_code from the demo pattern (writing a line, printing, inspecting the output); no frame was reviewed, and the title says '(Visually Explained)' which may indicate additional on-screen graphics not evident from transcript alone."
   ]
  },
  {
   "proposal_id": "prop_DCDe29sIKcE_pandas_str_accessor_cleaning",
   "concept_id": "pandas.str_accessor_cleaning",
   "path_id": "data_analyst",
   "video_id": "DCDe29sIKcE",
   "start_seconds": 939,
   "end_seconds": 1033,
   "label": "Lowercasing every value in a column at once with Series.str.lower()",
   "role": "worked_example",
   "covered_fact_ids": [
    "f1"
   ],
   "visual_mode": "annotated_code",
   "chapter_aligned": true,
   "transcript_evidence": "DF email is equal to DF e mail dot string dot lowercase so if I run this and then we look at our data frame now those changes actually did go through and all of our emails are now lowercase",
   "issues": [
    "Auto-captions render '.str' as 'dot STR' / 'dot string' (mishearing); the actual code on screen is Series.str.lower() -- this is a transcription quirk, not the video making an error.",
    "This video also maps to pandas.apply_transform in this chunk; this range intentionally ends before the apply/map/applymap comparison that follows, since that belongs to the other concept, not because of any blocked-concept conflict."
   ]
  },
  {
   "proposal_id": "prop_DCDe29sIKcE_pandas_apply_transform",
   "concept_id": "pandas.apply_transform",
   "path_id": "data_analyst",
   "video_id": "DCDe29sIKcE",
   "start_seconds": 1353,
   "end_seconds": 1680,
   "label": "DataFrame.apply() applies a function per-column by default, or per-row with axis='rows'",
   "role": "live_code_demo",
   "covered_fact_ids": [
    "f1"
   ],
   "visual_mode": "live_code",
   "chapter_aligned": false,
   "transcript_evidence": "so now let's look at how apply works with data frames so far we've only been using this with a series ... now when we run apply on a data frame it runs a function on each row or column of that data frame",
   "issues": [
    "Start (1353s) is a clean new-thought transition ('now let's look at how apply works with data frames') but sits mid-chapter inside the creator's 'Using the apply method' chapter (1056s), not on the chapter marker itself -- chapter_aligned is false for that reason.",